{
  "mode_id": "WORD_OF_THE_DAY",
  "display_name": "translated",
  "icon": "word",
  "cacheable": true,
  "description": "translated，translated",
  "content": {
    "type": "llm_json",
    "prompt_template": "translated。Get by translated，translated，translated。\ntranslated JSON translated：{{\"word\": \"translated\", \"phonetic\": \"translated（translated）\", \"definition\": \"translated（15translated）\", \"example\": \"translated（translated，20translated）\"}}\ntranslated。\ntranslated：{context}",
    "output_schema": {
      "word": { "type": "string", "default": "Serendipity" },
      "phonetic": { "type": "string", "default": "/ˌser.ənˈdɪp.ə.ti/" },
      "definition": { "type": "string", "default": "translated" },
      "example": { "type": "string", "default": "Traveling is full of serendipity." }
    },
    "temperature": 0.8,
    "fallback": {
      "word": "Serendipity",
      "phonetic": "/ˌser.ənˈdɪp.ə.ti/",
      "definition": "translated",
      "example": "Traveling is full of serendipity."
    }
  },
  "layout": {
    "status_bar": { "line_width": 1 },
    "body": [
      {
        "type": "centered_text",
        "field": "word",
        "font": "noto_serif_bold",
        "font_size": 64,
        "max_width_ratio": 0.9,
        "vertical_center": true
      },
      { "type": "spacer", "height": 8 },
      {
        "type": "text",
        "field": "phonetic",
        "font": "noto_serif_light",
        "font_size": 11,
        "align": "center",
        "max_lines": 1
      },
      { "type": "spacer", "height": 20 },
      {
        "type": "text",
        "field": "definition",
        "font": "noto_serif_regular",
        "font_size": 16,
        "align": "center",
        "max_lines": 2
      },
      { "type": "spacer", "height": 15 },
      {
        "type": "text",
        "field": "example",
        "font": "lora_italic",
        "font_size": 12,
        "align": "center",
        "max_lines": 2
      }
    ],
    "footer": { "label": "WORD", "attribution_template": "— Daily Learning" }
  }
}

