{
  "mode_id": "HALO_F1_NEWS",
  "display_name": "Halo F1 vijesti",
  "icon": "global",
  "cacheable": false,
  "description": "Najnoviji naslovi Formule 1 inspirirani Halo F1.",
  "settings_schema": [
    {
      "key": "item_limit",
      "label": "Naslovi",
      "type": "number",
      "default": 5,
      "min": 3,
      "max": 8,
      "step": 1,
      "description": "Koliko F1 naslova dohvatiti iz RSS feeda."
    }
  ],
  "content": {
    "type": "external_data",
    "provider": "halo_f1_news",
    "fallback": {
      "lead_title": "Nema dostupnih F1 naslova",
      "lead_desc": "Pokušajte ponovno za nekoliko minuta.",
      "lead_pub_date": "",
      "news_items": [
        {
          "short_title": "Feed nedostupan"
        }
      ]
    }
  },
  "layout": {
    "status_bar": {
      "line_width": 1,
      "dashed": false
    },
    "body": [
      {
        "type": "text",
        "text": "F1 vijesti",
        "font_size": 16,
        "align": "center",
        "max_lines": 1,
        "margin_x": 14
      },
      {
        "type": "text",
        "text": "Najnoviji naslovi u paddocku",
        "font_size": 9,
        "align": "center",
        "max_lines": 1,
        "margin_x": 14
      },
      {
        "type": "spacer",
        "height": 3
      },
      {
        "type": "separator",
        "style": "solid",
        "line_width": 1,
        "margin_x": 14
      },
      {
        "type": "spacer",
        "height": 6
      },
      {
        "type": "text",
        "field": "lead_title",
        "font_size": 14,
        "align": "left",
        "margin_x": 14,
        "max_lines": 2
      },
      {
        "type": "spacer",
        "height": 3
      },
      {
        "type": "text",
        "field": "lead_desc",
        "font_size": 10,
        "align": "left",
        "margin_x": 14,
        "max_lines": 3
      },
      {
        "type": "spacer",
        "height": 4
      },
      {
        "type": "text",
        "field": "lead_pub_date",
        "font_size": 9,
        "align": "right",
        "margin_x": 14,
        "max_lines": 1
      },
      {
        "type": "spacer",
        "height": 4
      },
      {
        "type": "separator",
        "style": "dashed",
        "margin_x": 14
      },
      {
        "type": "spacer",
        "height": 4
      },
      {
        "type": "group",
        "title": "Više naslova",
        "title_font_size": 11,
        "margin_x": 14,
        "children": [
          {
            "type": "list",
            "field": "news_items",
            "item_template": "{short_title}",
            "font_size": 10,
            "item_spacing": 12,
            "margin_x": 14,
            "max_items": 7
          }
        ]
      }
    ],
    "footer": {
      "label": "F1 VIJESTI",
      "attribution_template": "— Utrka"
    }
  }
}
